{
  "id": "sunken_archive",
  "name": "沉沒檔案庫",
  "theme": "潮濕石廊與失控魔導機關",
  "narrativeHook": "你踩進積水，牆上殘存的符文像呼吸般明滅。",
  "difficulty": 4,
  "rooms": [
    {
      "id": "archive_gate",
      "name": "檔案庫外門",
      "description": "鏽蝕門環掛在半開石門上，門縫裡吹出帶鹽味的冷風。",
      "exits": {
        "north": "flooded_stacks"
      },
      "items": ["torch"],
      "monster": null
    },
    {
      "id": "flooded_stacks",
      "name": "浸水書庫",
      "description": "書架傾倒在水面，漂浮的殘頁黏在你的靴子上。",
      "exits": {
        "south": "archive_gate",
        "east": "core_vault"
      },
      "items": ["small_potion"],
      "monster": "skeleton_guard"
    },
    {
      "id": "core_vault",
      "name": "核心保管室",
      "description": "破裂的晶體容器排列成圓環，中央控制台仍有微弱脈動。",
      "exits": {
        "west": "flooded_stacks"
      },
      "items": ["ancient_core"],
      "monster": "ruin_guardian"
    }
  ]
}
